{
  "campagne": "ridge-line-closure-image",
  "titre": "The Ridge Line closes for water",
  "texte": "Crews rebuild the culverts every October. The route reopens when they finish.",
  "source": "Ridge Line maintenance plan, section 2",
  "alt": "A gravel track between birch trees in autumn light",
  "image": { "id": "img-1", "identite": "A gravel track between birch trees in autumn light", "cadrage": "50% 40%" }
}
